{
  "$schema": "http://json-schema.org/draft-07/schema#",
  "$id": "https://mcp-od/schemas/mcp-plugin.schema.json",
  "title": "MCP OD Plugin Manifest",
  "type": "object",
  "required": ["name", "version", "sdk", "entry", "capabilities"],
  "properties": {
    "name": { "type": "string", "pattern": "^[a-z0-9][a-z0-9-_]{1,63}$" },
    "version": { "type": "string" },
    "sdk": { "type": "string" },
    "entry": { "type": "string" },
    "capabilities": {
      "type": "object",
      "properties": {
        "tools": {
          "type": "array",
          "items": { "$ref": "#/definitions/tool" }
        },
        "resources": {
          "type": "array",
          "items": { "$ref": "#/definitions/resource" }
        },
        "prompts": {
          "type": "array",
          "items": { "$ref": "#/definitions/prompt" }
        }
      },
      "additionalProperties": false
    },
    "permissions": {
      "type": "array",
      "items": {
        "type": "object",
        "required": ["id"],
        "properties": {
          "id": { "type": "string" },
          "reason": { "type": "string" }
        }
      }
    },
    "dependencies": {
      "type": "array",
      "items": { "type": "string" }
    },
    "metadata": {
      "type": "object",
      "properties": {
        "displayName": { "type": "string" },
        "author": { "type": "string" },
        "homepage": { "type": "string" }
      },
      "additionalProperties": true
    }
  },
  "additionalProperties": false,
  "definitions": {
    "zodShape": {
      "type": "object",
      "description": "JSON schema-like representation (derived from zod).",
      "additionalProperties": true
    },
    "tool": {
      "type": "object",
      "required": ["name"],
      "properties": {
        "name": { "type": "string" },
        "title": { "type": "string" },
        "description": { "type": "string" },
        "inputSchema": { "$ref": "#/definitions/zodShape" },
        "outputSchema": { "$ref": "#/definitions/zodShape" },
        "annotations": {
          "type": "object",
          "properties": {
            "title": { "type": "string" },
            "readOnlyHint": { "type": "boolean" },
            "destructiveHint": { "type": "boolean" },
            "idempotentHint": { "type": "boolean" },
            "openWorldHint": { "type": "boolean" }
          },
          "additionalProperties": true
        }
      },
      "additionalProperties": false
    },
    "resource": {
      "type": "object",
      "required": ["name", "uriTemplate"],
      "properties": {
        "name": { "type": "string" },
        "title": { "type": "string" },
        "metadata": { "type": "object", "additionalProperties": true },
        "uriTemplate": { "type": "string" }
      },
      "additionalProperties": false
    },
    "prompt": {
      "type": "object",
      "required": ["name"],
      "properties": {
        "name": { "type": "string" },
        "title": { "type": "string" },
        "description": { "type": "string" },
        "argsSchema": { "$ref": "#/definitions/zodShape" }
      },
      "additionalProperties": false
    }
  }
}
