{
  "name": "spec-minimal",
  "version": "1.0.0",
  "sdk": "@modelcontextprotocol/sdk",
  "entry": "index.js",
  "capabilities": {
    "tools": [
      {
        "name": "spec_echo",
        "inputSchema": {
          "type": "object",
          "properties": { "msg": { "type": "string" } },
          "required": ["msg"]
        }
      }
    ]
  }
}
